rule,type,nlc,dc,sql,link
Bids must be typewritten or written legibly in ink,,Verify that all bids are either typewritten or written legibly in ink.,,,FALSE
Erasures or alterations shall be initialed by the signer in ink or by electronic signature,,Verify that all erasures or alterations are initialed by the signer either in ink or by electronic signature.,,,FALSE
All bids must be signed in ink or by electronic signature,,Verify that all bids are signed in ink or by electronic signature.,,,FALSE
"The bid invitation also will also require that the bid be submitted in a sealed envelope, addressed as required in the bid documents",,Verify that each bid is submitted in a sealed envelope and is addressed as required in the bid documents.,,,FALSE
"Where award will be made to the bidder whose bid represents the best value to the City, the IFB may also provide that other information requested, if any, may be submitted up to thirty (30) days from the bid opening by all bidders whose bids are to be considered pursuant to Section 3-02(o)(1)(iii) of these Rules.",,Verify that all bidders whose bids are to be considered pursuant to Section 3-02(o)(1)(iii) have submitted any requested additional information within thirty (30) days from the bid opening.,,,FALSE
"The IFB shall state that the submission of bid samples and descriptive literature, regardless of any attempt by a bidder to condition the bid, will not be deemed to vary any of the provisions of the IFB",,"Verify that the IFB states that the submission of bid samples and descriptive literature, regardless of any attempt by a bidder to condition the bid, is not deemed to vary any of the provisions of the IFB.",,,FALSE
"IFBs or notices of their availability must be electronically mailed to a sufficient number of vendors, including all vendors on the appropriate citywide bidders list established by the CCPO for the purpose of securing competition",,"Verify that IFBs or notices of their availability are electronically mailed to a sufficient number of vendors, including all vendors on the appropriate citywide bidders list established by the CCPO for the purpose of securing competition.",,,FALSE
"IFBs or notices of their availability may be sent electronically to vendors on agency-specific bidders lists, in addition to the appropriate citywide bidders list maintained by the CCPO, only with approval of the CCPO.",,"Verify that IFBs or notices of their availability are sent electronically to vendors on agency-specific bidders lists, in addition to the citywide bidders list maintained by the CCPO, only with the approval of the CCPO.",,,FALSE
"Such IFBs or notices must be sent electronically at least fifteen (15) days in advance of the due date for bids, or at least twenty-two (22) days in advance of the due date for bids which are subject to Section 6-129 of the New York City Administrative Code (M/WBE and EBE program)",,"Verify that all IFBs or notices are sent electronically at least fifteen (15) days before the due date for bids, or at least twenty-two (22) days before the due date for bids subject to Section 6-129 of the New York City Administrative Code (M/WBE and EBE program).",,,FALSE
"An agency may, upon request of a vendor, provide IFBs or notices by mail, fax, hand delivery, or otherwise",,"Verify that, upon request of a vendor, an agency provides IFBs or notices by mail, fax, hand delivery, or other means.",,,FALSE
"Where the notice does not include all IFB documents, an additional five (5) days must be allowed",,Verify that an additional five (5) days are allowed when the notice does not include all IFB documents.,,,FALSE
"Notices of availability must indicate, at minimum: (A) the name of the agency and, if appropriate, the specific division or bureau soliciting the bids; (B) title and brief description of the goods, services, or construction required; (C) specific information about how, when, and where the IFB is available; (D) the required fee or deposit amount, if any, for obtaining the IFB; (E) the time, date, and location of any pre-bid conference or site visit, if any, and if attendance is mandatory; (F) the date, time, and location and, if applicable, a link to access the livestreaming of the opening, reading, and identification of bids on a publicly accessible website, for the receipt and opening of bids; (G) the name and phone number of the agency contact person, including email address, if applicable; and (H) the citywide bidders list used",,"Verify that notices of availability include at minimum: the name of the agency and, if appropriate, the specific division or bureau soliciting the bids; the title and brief description of the goods, services, or construction required; specific information about how, when, and where the IFB is available; the required fee or deposit amount, if any, for obtaining the IFB; the time, date, and location of any pre-bid conference or site visit, if any, and if attendance is mandatory; the date, time, and location and, if applicable, a link to access the livestreaming of the opening, reading, and identification of bids on a publicly accessible website, for the receipt and opening of bids; the name and phone number of the agency contact person, including email address, if applicable; and the citywide bidders list used.","[""AgencyName IS NULL""], [""SectionName IS NULL""], [""ShortTitle IS NULL""], [""AdditionalDescription1 IS NULL""], [""AddressToRequest IS NULL""], [""ContractAmount IS NULL""], [""EventDate IS  NULL""], [""EventStreetAddress1 IS NULL""], [""DocumentLinks IS NULL""], [""ContactName IS NULL""], [""ContactPhone IS  NULL""], [""Email IS NULL""]",SELECT * FROM contract_award WHERE AgencyName IS NULL OR SectionName IS NULL OR ShortTitle IS NULL OR AdditionalDescription1 IS NULL OR AddressToRequest IS NULL OR ContractAmount IS NULL OR EventDate IS  NULL OR EventStreetAddress1 IS NULL OR DocumentLinks IS NULL OR ContactName IS NULL OR ContactPhone IS  NULL OR Email IS NULL,TRUE
"Notice of solicitation shall be published at lease once in the City Record and shall be posted on the City’s website in a location that is accessible by the public simultaneously with its publication not less than fifteen days before the bid opening date with the exception of accelerated procurements, which shall appear not less than three business days before the bid opening date",,"Verify that the notice of solicitation is published at least once in the City Record and is posted on the City’s website in a publicly accessible location simultaneously with its publication not less than fifteen days before the bid opening date, except for accelerated procurements, which must appear not less than three business days before the bid opening date.",,,FALSE
"Such notice shall include: ((a)) agency name; ((b)) PIN; ((c)) title and/or brief description of the goods, services, or construction to be procured; ((d)) estimated quantity, if any; ((e)) how the solicitation documents may be obtained; ((f)) date and time by which, and the location where, bids must be submitted and will be publicly opened and if applicable, a link to access the livestreaming of the opening, reading, and identification of bids on a publicly accessible website; and ((g)) required vendor qualifications or eligibility requirements, if any and ((h)) A statement, if applicable, that the solicitation is subject to Section 6-129 of the Administrative Code (M/WBE and EBE program)",,"Verify that each notice includes the following: (a) agency name, (b) PIN, (c) title and/or brief description of the goods, services, or construction to be procured, (d) estimated quantity, if any, (e) how the solicitation documents may be obtained, (f) date and time by which, and the location where, bids must be submitted and will be publicly opened, and if applicable, a link to access the livestreaming of the opening, reading, and identification of bids on a publicly accessible website, (g) required vendor qualifications or eligibility requirements, if any, and (h) a statement, if applicable, that the solicitation is subject to Section 6-129 of the Administrative Code (M/WBE and EBE program).","[""AgencyName IS NULL""], [""PIN IS NULL""], [""ShortTitle IS NULL""], [""AddressToRequest IS NULL""], [""DueDate IS NULL""], [""EventStreetAddress1 IS NULL""], [""DocumentLinks IS NULL""], [""SelectionMethodDescription IS NULL""]",SELECT * FROM contract_award WHERE AgencyName IS NULL OR PIN IS NULL OR ShortTitle IS NULL OR AddressToRequest IS NULL OR DueDate IS NULL OR EventStreetAddress1 IS NULL OR DocumentLinks IS NULL OR SelectionMethodDescription IS NULL,TRUE
Notice of vendor selection exceeding the small purchase limits shall be published once in the City Record within fifteen days after registration of the contract,,Verify that notice of vendor selection exceeding the small purchase limits is published once in the City Record within fifteen days after registration of the contract.,,,FALSE
"Such notice shall include: (A) agency name; (B) PIN; (C) title and/or brief description of the goods, services, or construction procured; (D) name and address of the vendor; (E) dollar value of the contract; and (F) procurement method by which the contract was let",,"Verify that each notice includes the agency name, PIN, title and/or brief description of the goods, services, or construction procured, name and address of the vendor, dollar value of the contract, and procurement method by which the contract was let.","[""AgencyName IS NULL""], [""PIN IS NULL""], [""ShortTitle IS NULL""], [""VendorName IS NULL""], [""VendorAddress IS NULL""], [""ContractAmount IS NULL""], [""SelectionMethodDescription IS NULL""]",SELECT * FROM contract_award WHERE AgencyName IS NULL OR PIN IS NULL OR ShortTitle IS NULL OR VendorName IS NULL OR VendorAddress IS NULL OR ContractAmount IS  NULL OR SelectionMethodDescription IS NULL,TRUE
A copy of the IFB shall be available for public inspection at a location in the agency offices designated by the ACCO,,Verify that a copy of the IFB is available for public inspection at a location in the agency offices designated by the ACCO.,,,FALSE
The CCPO shall compile citywide lists of vendors interested in being solicited for bids,,Verify that the CCPO compiles citywide lists of vendors interested in being solicited for bids.,,,FALSE
the CCPO may authorize one or more agencies to maintain citywide or agency bidders lists,,Check if the CCPO has authorized one or more agencies to maintain citywide or agency bidders lists.,,,FALSE
"Bidders lists shall be classified by standard categories of goods, services, and construction that are sufficiently detailed to provide meaningful distinctions among categories",,"Verify that bidders lists are classified by standard categories of goods, services, and construction that are sufficiently detailed to provide meaningful distinctions among categories.",,,FALSE
"Bidders lists shall include the names, addresses, EIN, e-mail addresses, and telephone numbers of the vendors",,"Verify that bidders lists include the names, addresses, EIN, e-mail addresses, and telephone numbers of the vendors.","[""VendorName IS NULL""], [""VendorAddress IS NULL""], [""Email IS NULL""], [""ContactPhone IS NULL""]",SELECT * FROM contract_award WHERE VendorName IS NULL OR VendorAddress IS  NULL OR Email IS NULL OR ContactPhone IS NULL,TRUE
"bidders lists shall indicate which of the listed businesses have been certified by DSBS as minority owned, women owned and emerging business enterprises",,"Verify that bidders lists indicate which of the listed businesses have been certified by DSBS as minority owned, women owned, and emerging business enterprises.",,,FALSE
"The CCPO and agencies, if authorized by the CCPO to maintain bidders lists, shall cause to be continuously published in the City Record notice of the availability of applications for vendors to be added to citywide bidders lists or agency bidders lists for goods, services, and construction regularly procured by the City",,"Verify that the CCPO and authorized agencies continuously publish in the City Record notice of the availability of applications for vendors to be added to citywide or agency bidders lists for goods, services, and construction regularly procured by the City.",,,FALSE
"Every effort shall be made to publish notice in a manner that encourages minority, women and emerging business enterprises to certify with DSBS",,"Verify that notices are published in a manner that encourages minority, women, and emerging business enterprises to certify with DSBS.",,,FALSE
Application by vendors for placement on the citywide bidders lists or an agency’s bidders list shall be continuously available on request from the vendor,,Verify that applications by vendors for placement on the citywide bidders lists or an agency’s bidders list are continuously available upon request from the vendor.,,,FALSE
Vendors that fail to respond to solicitations or notices of availability of procurement opportunities on three consecutive invitations within one standard category may be removed by the CCPO from the applicable bidders list or by the ACCO from the applicable agency bidder list after notice to the vendor,,"Check if any vendors have failed to respond to solicitations or notices of availability of procurement opportunities on three consecutive invitations within one standard category, and if so, ensure they have been notified and considered for removal by the CCPO from the applicable bidders list or by the ACCO from the applicable agency bidder list.",,,FALSE
A “No Bid” statement on a returned bid shall be considered a response,,Verify that a 'No Bid' statement on a returned bid is considered a response.,,,FALSE
Vendors may also be removed from a citywide bidders list pursuant to procedures prescribed by the CCPO,,Check if vendors have been removed from a citywide bidders list according to the procedures prescribed by the CCPO.,,,FALSE
Application for reinstatement shall be the responsibility of the vendor,,Verify that the application for reinstatement is the responsibility of the vendor.,,,FALSE
"Unless otherwise provided, inclusion or exclusion of the name of a vendor on a bidders list does not indicate that the vendor is responsible in respect to a particular procurement or otherwise is capable of successfully performing a City contract",,"Verify that the inclusion or exclusion of a vendor's name on a bidders list does not indicate the vendor's responsibility for a particular procurement or capability to successfully perform a City contract, unless otherwise provided.",,,FALSE
"In accordance with these Rules, bids may be solicited from a list of prequalified vendors",,Verify that bids are solicited only from a list of prequalified vendors.,,,FALSE
Pre-bid or pre-solicitation conferences may be conducted by the ACCO to explain the procurement requirements,,Check if the ACCO conducts pre-bid or pre-solicitation conferences to explain the procurement requirements.,,,FALSE
Written notice of any conference shall be provided to all prospective vendors,,Verify that written notice of any conference is provided to all prospective vendors.,,,FALSE
"A pre-bid conference should be held long enough after the IFB has been issued to allow bidders to become familiar with the solicitation documents, but sufficiently before bid opening to allow consideration of the conference results in preparing their bids",,"Verify that a pre-bid conference is held long enough after the IFB has been issued to allow bidders to become familiar with the solicitation documents, and sufficiently before bid opening to allow consideration of the conference results in preparing their bids.",,,FALSE
Nothing stated at the pre-bid conference shall change the IFB unless a change is made by amendment as provided in this section,,Verify that no changes to the IFB are made based on statements from the pre-bid conference unless those changes are made by amendment as provided in this section.,,,FALSE
A summary or transcript of the conference shall be prepared and shall be made available and shall be posted on the City’s website,,"Verify that a summary or transcript of the conference is prepared, made available, and posted on the City’s website.",,,FALSE
"A record of attendance shall be kept of all conferences, and shall be made available and shall be posted on the City’s website",,"Verify that a record of attendance is kept for all conferences, is made available, and is posted on the City’s website.",,,FALSE
The ACCO shall authorize the issuance of any amendment,,Verify that the ACCO has authorized the issuance of any amendment.,,,FALSE
"Each amendment to an IFB shall be identified as such, shall be set forth in writing, and shall require that the bidder acknowledge receipt of all amendments issued as a condition for consideration of its bid",,"Verify that each amendment to an IFB is identified as an amendment, is set forth in writing, and requires that the bidder acknowledges receipt of all amendments issued as a condition for consideration of its bid.",,,FALSE
The amendment shall reference the portion of the IFB it amends,,Verify that the amendment references the portion of the IFB it amends.,,,FALSE
Amendments shall be sent to all prospective vendors known to have received an IFB,,Verify that amendments are sent to all prospective vendors known to have received an IFB.,,,FALSE
Amendments shall be distributed within a reasonable time to allow prospective vendors to consider them in preparing their bids,,Verify that amendments are distributed within a reasonable time to allow prospective vendors to consider them in preparing their bids.,,,FALSE
"If the time and date set for receipt of bids will not permit such preparation, such time shall be increased to the extent possible, and stated in the amendment or shall be communicated by electronic mail, facsimile, or telephone and confirmed in the amendment",,"Verify that if the time and date set for receipt of bids do not permit preparation, the time is increased to the extent possible and stated in the amendment, or communicated by electronic mail, facsimile, or telephone and confirmed in the amendment.",,,FALSE
A notice of amendment shall be posted on the City’s website,,Verify that a notice of amendment is posted on the City’s website.,,,FALSE
Bids may be modified or withdrawn by written notice received in the office designated in the IFB before the time and date set for bid opening,,Verify that any modifications or withdrawals of bids are accompanied by a written notice received in the designated office before the time and date set for bid opening.,,,FALSE
"If a bid is withdrawn in accordance with this section, the bid security, if any, shall be returned to the bidder",,"Verify that for any bid withdrawn in accordance with this section, the bid security, if any, is returned to the bidder.",,,FALSE
Any bid received at the location designated in the solicitation after the time and date set for receipt of bids is late and shall not be considered,,Verify that no bid received at the location designated in the solicitation after the time and date set for receipt of bids is considered.,,,FALSE
Any request for withdrawal or modification received at the location designated in the solicitation after the time and date set for receipt of bids is late and shall not be considered,,Verify that any request for withdrawal or modification received at the designated location after the specified time and date for receipt of bids is not considered.,,,FALSE
Late bids and modifications shall not be opened until after registration of the contract,,Verify that late bids and modifications are not opened until after the registration of the contract.,,,FALSE
A late modification of a successful bid that makes its terms more favorable to the City shall be considered at any time it is received and may be accepted upon the approval of the ACCO,,Verify that any late modification of a successful bid that makes its terms more favorable to the City is considered at any time it is received and is accepted only upon the approval of the ACCO.,,,FALSE
"Upon its receipt, each bid and modification shall be time- and date-stamped, but not opened, and stored in a secure location until the time and date set for bid opening",,"Verify that upon receipt, each bid and modification is time- and date-stamped, is not opened, and is stored in a secure location until the time and date set for bid opening.",,,FALSE
Before bid opening the agency may not disclose the identity of any bidder,,Verify that the agency does not disclose the identity of any bidder before bid opening.,,,FALSE
"Bids and modifications will be opened publicly, at the time, date, and location designated in the IFB",,"Verify that bids and modifications are opened publicly at the time, date, and location designated in the IFB.",,,FALSE
"The name of each bidder, the bid price, and such other information as is deemed appropriate will be read aloud or otherwise made available",,"Verify that the name of each bidder, the bid price, and any other deemed appropriate information are read aloud or otherwise made available.",,,FALSE
"These requirements may be met through access to a computer terminal at the location where bids are to be opened, provided that paper documents are available upon request at the time of in-person bid opening",,"Verify that access to a computer terminal is available at the location where bids are to be opened, and ensure that paper documents are available upon request at the time of in-person bid opening.",,,FALSE
This information also will be recorded at the time of bid opening,,Verify that this information is recorded at the time of bid opening.,,,FALSE
The bids will be tabulated or a bid abstract prepared and made available for public inspection,,Verify that the bids are either tabulated or a bid abstract is prepared and made available for public inspection.,,,FALSE
The opened bids will be available for public inspection within five days of bid opening but in any case before vendor selection except to the extent the bidder designates trade secrets or other proprietary data to be confidential,,"Verify that all opened bids are available for public inspection within five days of bid opening and before vendor selection, except for parts designated as trade secrets or proprietary data by the bidder.",,,FALSE
Material so designated must accompany the bid and must be readily separable from the bid in order to facilitate public inspection of the nonconfidential portion of the bid,,Verify that the designated material accompanies the bid and is readily separable from the bid to facilitate public inspection of the nonconfidential portion of the bid.,,,FALSE
"Prices, makes, and model or catalog numbers of the items offered, deliveries, and terms of payment will be publicly available at a reasonable time after bid opening but in any event before vendor selection regardless of any designation to the contrary at the time of bid opening",,"Verify that prices, makes, model or catalog numbers of the items offered, deliveries, and terms of payment are publicly available at a reasonable time after bid opening and before vendor selection, regardless of any designation to the contrary at the time of bid opening.",,,FALSE
"For bids on construction contracts submitted in accordance with Section 3-02(b)(2)(xx)(J) of these Rules, the sealed list of subcontractors submitted with the low bid will be opened after such low bid has been announced and the names of the subcontractors shall be announced",,"Verify that for bids on construction contracts submitted in accordance with Section 3-02(b)(2)(xx)(J), the sealed list of subcontractors submitted with the low bid is opened after the low bid has been announced and the names of the subcontractors are announced.",,,FALSE
The sealed lists of subcontractors submitted by all other bidders pursuant to Section 3-02(b)(2)(xx)(J) of these Rules will be returned to such bidders unopened after the contract award,,Verify that the sealed lists of subcontractors submitted by all other bidders are returned to them unopened after the contract award.,,,FALSE
The ACCO shall examine the bids to determine the validity of any requests for nondisclosure of trade secrets and other proprietary data identified in writing,,Verify that the ACCO examines the bids to determine the validity of any requests for nondisclosure of trade secrets and other proprietary data identified in writing.,,,FALSE
Nondisclosure is permissible only if approved by Agency Counsel,,Verify that nondisclosure is approved by Agency Counsel before it is considered permissible.,,,FALSE
Any decision not to honor a request for confidentiality shall be communicated in writing to the bidder making the submission,,Verify that any decision not to honor a request for confidentiality is communicated in writing to the bidder making the submission.,,,FALSE
"Correction or withdrawal of a bid because of an inadvertent, nonjudgmental mistake in the bid requires careful consideration to protect the integrity of the competitive bidding system, and to assure fairness",,"Verify that any correction or withdrawal of a bid due to an inadvertent, nonjudgmental mistake is carefully considered to protect the integrity of the competitive bidding system and assure fairness.",,,FALSE
"If the mistake is attributable to an error in judgment, the bid may not be corrected",,Check if any bid that is attributable to an error in judgment has not been corrected.,,,FALSE
