rule,type,nlc,dc,sql,link
"Unless otherwise authorized by law, all City procurements shall be made by one of the methods authorized by these Rules",,"Verify that all City procurements are made by one of the methods authorized by these Rules, unless otherwise authorized by law.","[""SpecialCaseReasonDescription IS NULL"", ""SelectionMethodDescription NOT IN ('M/WBE Noncompetitive Small Purchase', 'Renewal', 'Emergency Purchase', 'Competitive Sealed Bids', 'Competitive Sealed Proposals', 'Negotiated Acquisition', 'Competitive Sealed Proposals/Pre-Qualified List', 'Government to Government', 'Intergovernmental Purchase', 'Request for Proposals', 'Sole Source', 'Other', 'Required/Authorized Source', 'Required Method (including Preferred Source)', 'Negotiated Acquisition/Pre-Qualified List', 'Competitive Sealed Bids/Pre-Qualified List', 'Request for Quote', 'BP/City Council Discretionary', 'Small Purchase', 'Contract Change', 'Innovative Procurement', 'Line Item Appropriation or Discretionary Funds', 'Demonstration Project', 'Contract with another Government', 'Public Bid', 'CP/2', 'Cooperative Purchasing', 'IG/S', 'RS', 'Client Services Waiver', 'Request for Qualifications', 'Request for Information')""]","SELECT * FROM contract_award WHERE SpecialCaseReasonDescription IS NULL  AND SelectionMethodDescription NOT IN ('M/WBE Noncompetitive Small Purchase', 'Renewal', 'Emergency Purchase', 'Competitive Sealed Bids', 'Competitive Sealed Proposals', 'Negotiated Acquisition', 'Competitive Sealed Proposals/Pre-Qualified List', 'Government to Government', 'Intergovernmental Purchase', 'Request for Proposals', 'Sole Source', 'Other', 'Required/Authorized Source', 'Required Method (including Preferred Source)', 'Negotiated Acquisition/Pre-Qualified List', 'Competitive Sealed Bids/Pre-Qualified List', 'Request for Quote', 'BP/City Council Discretionary', 'Small Purchase', 'Contract Change', 'Innovative Procurement', 'Line Item Appropriation or Discretionary Funds', 'Demonstration Project', 'Contract with another Government', 'Public Bid', 'CP/2', 'Cooperative Purchasing', 'IG/S', 'RS', 'Client Services Waiver', 'Request for Qualifications', 'Request for Information')",TRUE
"Except as otherwise provided in these Rules, contracts shall be awarded by competitive sealed bidding",,"Verify that contracts are awarded by competitive sealed bidding, except as otherwise provided in these Rules.","[""SelectionMethodDescription <> 'Competitive Sealed Bids'"", ""SpecialCaseReasonDescription IS NULL""]",SELECT * FROM contract_award WHERE SelectionMethodDescription <> 'Competitive Sealed Bids' AND (SpecialCaseReasonDescription IS NULL),TRUE
"In the case of construction, where appropriate in the judgment of the ACCO, and in accordance with these Rules, competitive sealed bidding from prequalified vendors or any other appropriate procurement method may be used",,"Verify that, in the case of construction, competitive sealed bidding from prequalified vendors or any other appropriate procurement method is used where deemed appropriate by the ACCO and in accordance with these Rules.",,,FALSE
"Procurement by competitive sealed proposals, including, where applicable, through HHS Accelerator, is the preferred method for awarding contracts for non-commodity data processing equipment and for information technology, non-commodity data processing, architectural, engineering, client, legal, accounting, financial, training, educational, cultural, medical, managed care, employee health benefits, scientific management, research, performing arts, and systems consultation services, and/or other similar services",,"Verify that contracts for non-commodity data processing equipment and services such as information technology, non-commodity data processing, architectural, engineering, client, legal, accounting, financial, training, educational, cultural, medical, managed care, employee health benefits, scientific management, research, performing arts, and systems consultation are awarded through competitive sealed proposals, including, where applicable, through HHS Accelerator.","[""SelectionMethodDescription NOT IN ('Competitive Sealed Proposals', 'HHS Accelerator')"",""CategoryDescription like '%non-commodity data processing equipment%'""], [""SelectionMethodDescription NOT IN ('Competitive Sealed Proposals', 'HHS Accelerator')"",""CategoryDescription like '%information technology%'""], [""SelectionMethodDescription NOT IN ('Competitive Sealed Proposals', 'HHS Accelerator')"",""CategoryDescription like '%non-commodity data processing%'""], [""SelectionMethodDescription NOT IN ('Competitive Sealed Proposals', 'HHS Accelerator')"",""CategoryDescription like '%architectural%'""], [""SelectionMethodDescription NOT IN ('Competitive Sealed Proposals', 'HHS Accelerator')"",""CategoryDescription like '%engineering%'""], [""SelectionMethodDescription NOT IN ('Competitive Sealed Proposals', 'HHS Accelerator')"",""CategoryDescription like '%client%'""], [""SelectionMethodDescription NOT IN ('Competitive Sealed Proposals', 'HHS Accelerator')"",""CategoryDescription like '%legal%'""], [""SelectionMethodDescription NOT IN ('Competitive Sealed Proposals', 'HHS Accelerator')"",""CategoryDescription like '%accounting%'""], [""SelectionMethodDescription NOT IN ('Competitive Sealed Proposals', 'HHS Accelerator')"",""CategoryDescription like '%financial%'""], [""SelectionMethodDescription NOT IN ('Competitive Sealed Proposals', 'HHS Accelerator')"",""CategoryDescription like '%training%'""], [""SelectionMethodDescription NOT IN ('Competitive Sealed Proposals', 'HHS Accelerator')"",""CategoryDescription like '%educational%'""], [""SelectionMethodDescription NOT IN ('Competitive Sealed Proposals', 'HHS Accelerator')"",""CategoryDescription like '%cultural%'""], [""SelectionMethodDescription NOT IN ('Competitive Sealed Proposals', 'HHS Accelerator')"",""CategoryDescription like '%medical%'""], [""SelectionMethodDescription NOT IN ('Competitive Sealed Proposals', 'HHS Accelerator')"",""CategoryDescription like '%managed care%'""], [""SelectionMethodDescription NOT IN ('Competitive Sealed Proposals', 'HHS Accelerator')"",""CategoryDescription like '%employee health benefits%'""], [""SelectionMethodDescription NOT IN ('Competitive Sealed Proposals', 'HHS Accelerator')"",""CategoryDescription like '%scientific management%'""], [""SelectionMethodDescription NOT IN ('Competitive Sealed Proposals', 'HHS Accelerator')"",""CategoryDescription like '%research%'""], [""SelectionMethodDescription NOT IN ('Competitive Sealed Proposals', 'HHS Accelerator')"",""CategoryDescription like '%performing arts%'""], [""SelectionMethodDescription NOT IN ('Competitive Sealed Proposals', 'HHS Accelerator')"",""CategoryDescription like '%systems consultation services%'""]","SELECT * FROM contract_award WHERE SelectionMethodDescription NOT IN ('Competitive Sealed Proposals', 'HHS Accelerator') AND (CategoryDescription like '%non-commodity data processing equipment%' or CategoryDescription like '%information technology%' or CategoryDescription like '%non-commodity data processing%' or CategoryDescription like '%architectural%' or CategoryDescription like '%engineering%' or CategoryDescription like '%client%' or CategoryDescription like '%legal%' or CategoryDescription like '%accounting%' or CategoryDescription like '%financial%' or CategoryDescription like '%training%' or CategoryDescription like '%educational%' or CategoryDescription like '%cultural%' or CategoryDescription like '%medical%' or CategoryDescription like '%managed care%' or CategoryDescription like '%employee health benefits%' or CategoryDescription like '%scientific management%' or CategoryDescription like '%research%' or CategoryDescription like '%performing arts%' or CategoryDescription like '%systems consultation services%')",TRUE
A “Special Case” determination is not required for such procurements,,Verify that a Special Case determination is not made for such procurements.,"[""SpecialCaseReasonDescription IS NULL"", ""CategoryDescription LIKE '%data processing equipment%'""], [""SpecialCaseReasonDescription IS NULL"", ""CategoryDescription LIKE '%similar services%'""]",SELECT * FROM contract_award WHERE SpecialCaseReasonDescription IS NULL AND (CategoryDescription LIKE '%data processing equipment%' OR CategoryDescription LIKE '%similar services%') ,TRUE
"Agencies may elect to use one of the methods of source selection listed herein, after making the determination that it is not practicable or not advantageous to the City to use competitive sealed bidding as required by this section",,Verify that agencies have made the determination that it is not practicable or not advantageous to the City to use competitive sealed bidding before electing to use one of the methods of source selection listed herein.,,,FALSE
"A Special Case determination is required for each case in which one of the following methods of source selection is used: (i) Competitive sealed bidding from prequalified vendors, except as provided in Section 3-10(a) of these Rules;(ii) Competitive sealed bidding where the award will be made to the bidder whose bid represents the best value to the City;(iii) Competitive sealed proposals (including multi-step process);(iv) Competitive sealed proposals from prequalified vendors;(v) Negotiated acquisition;(vi) Sole source procurement;(vii) Demonstration project for innovative products, approaches, or technologies;(viii) Innovative procurement method; or (ix) Government-to-government purchase.",,"Verify that a Special Case determination is made for each case where the method of source selection used is one of the following: competitive sealed bidding from prequalified vendors (except as provided in Section 3-10(a) of these Rules), competitive sealed bidding where the award is made to the bidder whose bid represents the best value to the City, competitive sealed proposals (including multi-step process), competitive sealed proposals from prequalified vendors, negotiated acquisition, sole source procurement, demonstration project for innovative products, approaches, or technologies, innovative procurement method, or government-to-government purchase.","[""SelectionMethodDescription in ('Competitive Sealed Bids','Competitive Sealed Bids/Pre-Qualified List','Competitive Sealed Proposals','Competitive Sealed Proposals/Pre-Qualified List','Negotiated Acquisition','Sole Source','Demonstration Project','Innovative Procurement','Government to Government')"", ""SpecialCaseReasonDescription IS NULL""]","SELECT * FROM contract_award WHERE SelectionMethodDescription in ('Competitive Sealed Bids','Competitive Sealed Bids/Pre-Qualified List','Competitive Sealed Proposals','Competitive Sealed Proposals/Pre-Qualified List','Negotiated Acquisition','Sole Source','Demonstration Project','Innovative Procurement','Government to Government') AND SpecialCaseReasonDescription IS NULL",TRUE
"A special case is a circumstance recognized by these Rules in which it is not practicable or not advantageous to the City to use competitive sealed bidding for one of the following reasons: (i) specifications cannot be made sufficiently definite and certain to permit selection based on bid price or evaluated bid price alone; (ii) judgment is required in evaluating competing proposals, and it is in the best interest of the City to require a balancing of price, quality, and other factors; (iii) it is in the best interest of the City for goods or standard services to be awarded on the basis of best value to the City by optimizing quality, cost, and efficiency; (iv) there is only one available source, as set forth in these Rules; (v) testing, experimentation, or evaluation is required to determine the feasibility and application of an innovative product, approach, or technology not currently used by the City; (vi) the need for advance screening of qualifications is paramount and prequalification is appropriate for one of the reasons set forth in these Rules; (vii) circumstances justifying the use of negotiated acquisition as set forth in these Rules; or (viii) to test and evaluate the feasibility and application of innovative procurement methods not currently used by the City or provided for in these Rules",,"Verify that a special case is recognized when it is not practicable or advantageous to use competitive sealed bidding for the following reasons: specifications cannot be made definite and certain for selection based on bid price alone; judgment is required for evaluating proposals with a balance of price, quality, and other factors; awarding goods or services based on best value by optimizing quality, cost, and efficiency is in the City's best interest; only one source is available; testing, experimentation, or evaluation is needed for innovative products or technologies not used by the City; advance screening of qualifications is paramount and prequalification is appropriate; circumstances justify negotiated acquisition; or to test and evaluate innovative procurement methods not used by the City.",,,FALSE
"Upon determining that there is a special case, the Contracting Officer shall select the most competitive alternate method of source selection among those listed in Section 3-01 above which is practicable and advantageous to the City",,"Verify that when a special case is determined, the Contracting Officer selects the most competitive alternate method of source selection from those listed in Section 3-01 that is practicable and advantageous to the City.",,,FALSE
"The determination that there is a special case, and the reasons that the method of source selection is the most competitive that is appropriate under the circumstances, shall be made in writing in advance of issuing solicitations, as part of any presolicitation review required by these Rules, and shall be approved by the ACCO",,"Verify that any determination of a special case, along with the reasons for the method of source selection being the most competitive under the circumstances, is documented in writing before issuing solicitations, as part of any required presolicitation review, and is approved by the ACCO.",,,FALSE
Procurements by negotiated acquisition shall require the written approval of the CCPO prior to initiating negotiations,,Verify that all procurements by negotiated acquisition have the written approval of the CCPO before negotiations are initiated.,"[""SelectionMethodDescription = 'Negotiated Acquisition'"", ""AdditionalDescription1 not LIKE '%CCPO%'""], [""SelectionMethodDescription = 'Negotiated Acquisition'"", ""upper(OtherInfo1) not LIKE '%CCPO%'""]",SELECT * FROM contract_award WHERE SelectionMethodDescription = 'Negotiated Acquisition' AND (AdditionalDescription1 not LIKE '%CCPO%' or OtherInfo1 not LIKE '%CCPO%'),TRUE
This section shall apply to all procurements made by competitive sealed bidding,,Verify that this section applies to all procurements made by competitive sealed bidding.,,,FALSE
The IFB is used to initiate a competitive sealed bid procurement,,Verify that the IFB is used to initiate a competitive sealed bid procurement.,,,FALSE
"The Invitation for Bids shall include the following: (i) instructions and information to bidders concerning the bid submission requirements, including the time and date set for receipt of the bids; requirements for the electronic submission of bids, if any; time, date, and location of any pre-bid conferences (and a statement whether such conferences are mandatory); and the location where bids are to be submitted; (ii) the purchase description, delivery and performance schedule, and any special instructions necessary; (iii) the contract terms and conditions, including warranty and bonding or other security requirements, as applicable",,"Verify that the Invitation for Bids includes: (i) instructions and information to bidders concerning the bid submission requirements, including the time and date set for receipt of the bids, requirements for the electronic submission of bids if any, time, date, and location of any pre-bid conferences with a statement on whether such conferences are mandatory, and the location where bids are to be submitted; (ii) the purchase description, delivery and performance schedule, and any special instructions necessary; (iii) the contract terms and conditions, including warranty and bonding or other security requirements, as applicable.",,,FALSE
"for construction, a statement that award shall be made to the lowest responsive and responsible bidder",,"Verify that for construction, the award is made to the lowest responsive and responsible bidder.",,,FALSE
"for purchase of goods and standard services, a statement that award shall be made to the lowest responsive and responsible bidder or to the bidder whose bid represents the best value to the City by optimizing quality, cost and efficiency",,"Verify that for the purchase of goods and standard services, the award is made to the lowest responsive and responsible bidder or to the bidder whose bid represents the best value to the City by optimizing quality, cost, and efficiency.",,,FALSE
"if not included in the bid documents, a notice of where vendors may obtain a copy of all contractual terms and conditions or other project-related material",,"Verify that if a notice is not included in the bid documents, there is a notice of where vendors may obtain a copy of all contractual terms and conditions or other project-related material.",,,FALSE
"a provision that bidders should give specific attention to the identification of those portions of their bids that they deem to be confidential proprietary information or trade secrets and provide any justification why such materials, upon request, should not be disclosed by the City",,Verify that bidders have identified portions of their bids as confidential proprietary information or trade secrets and have provided justification for why such materials should not be disclosed by the City upon request.,,,FALSE
bids may be withdrawn only after the expiration of fortyfive days from bid opening and only in writing received by the agency and in advance of award,,"Verify that bids are withdrawn only after the expiration of forty-five days from bid opening, only in writing received by the agency, and only in advance of award.",,,FALSE
contract award is subject to provisions of the MacBride Principles Law,,Verify that the contract award complies with the provisions of the MacBride Principles Law.,,,FALSE
"contract award is subject, if applicable, to Section 6-129 of the New York City Administrative Code (M/WBE and EBE program), as well as to applicable provisions of federal, State, and local laws and executive orders requiring affirmative action and equal employment opportunity",,"Verify that the contract award complies with Section 6-129 of the New York City Administrative Code (M/WBE and EBE program) if applicable, and adheres to the applicable provisions of federal, State, and local laws and executive orders requiring affirmative action and equal employment opportunity.",,,FALSE
"where applicable, a notice that contract award is subject to completion of a VENDEX questionnaire and review of that information by the Department of Investigation",,"Verify that, where applicable, a notice is present indicating that the contract award is subject to the completion of a VENDEX questionnaire and the review of that information by the Department of Investigation.",,,FALSE
"the name, address, and telephone number of a contact person to whom questions and correspondence relating to the bid solicitation can be addressed",,"Verify that the name, address, and telephone number of a contact person to whom questions and correspondence relating to the bid solicitation can be addressed are present.",,,FALSE
The New York City Comptroller is charged with the audit of contracts in New York City,,Verify that the New York City Comptroller audits all contracts in New York City.,,,FALSE
"Any vendor who believes that there has been unfairness, favoritism, or impropriety in the bid process should inform the Comptroller, Bureau of Contract Administration, 1 Centre Street, Room 727, New York, NY 10007, (212) 669- 2323",,"Verify that any vendor who believes there has been unfairness, favoritism, or impropriety in the bid process has informed the Comptroller, Bureau of Contract Administration, at 1 Centre Street, Room 727, New York, NY 10007, (212) 669-2323.",,,FALSE
"the bidder will be required to comply, if applicable, with § 220/230 of the New York State Labor Law, § 6-109 of the New York Administrative Code, Mayoral Executive Order 102 of 2006, and with all other federal, State, and local labor laws and regulations, including but not limited to providing on-the-job training opportunities and payment of prevailing wages and living wages",,"Verify that the bidder complies, if applicable, with § 220/230 of the New York State Labor Law, § 6-109 of the New York Administrative Code, Mayoral Executive Order 102 of 2006, and all other federal, State, and local labor laws and regulations, including providing on-the-job training opportunities and payment of prevailing wages and living wages.",,,FALSE
"where applicable for construction contracts, the following shall be additionally included: (A) a specific description and exact location of the construction and the date and time for the bidder to visit the job site when the solicitation requires a mandatory pre-bid visit to and examination of the job site; (B) a reference to all applicable documents which will subsequently become a part of the contract, such as the specifications and the terms and conditions approved by Corporation Counsel; (C) a statement establishing minimum insurance requirements which the City will require of the bidder if successful and conveying to the bidder any insurance coverage which the City will carry that will afford the contractor insurance coverage; (D) a statement that the bidder will be required to meet all licensing or permit requirements required to perform the construction; (E) a statement of instructions relative to the return of bid documents if the bidder elects not to submit a bid thereunder and notification to the City of the bidder declining to bid; (F) a statement that all bid documents must be returned to the City upon request; (G) the form in which the bid is to be submitted (either specified in the invitation for bids or referenced as part of the specifications or attached forms); (H) a requirement that for projects on which more than one prime contractor will be involved, all bidders examine the invitation for bid packages for all other parts of the project; and (I) a notice, for those contracts not otherwise subject to Section 6- 129 of the New York Administrative Code (M/WBE and EBE Program), that contract award is subject to the provisions of Section 6-108.1 of the New York City Administrative Code relating to the LBE program and its implementing rules; and (J) a requirement that, where the preparation of separate specifications is not required for plumbing and gas fitting; steam heating, hot water heating, ventilating and air conditioning apparatus; and electric wiring and standard illumination fixtures pursuant to New York General Municipal Law Section 101, the bidder shall submit with its bid a separate sealed list that names each subcontractor that the bidder will use to perform such work on the contract, and the agreed-upon amount to be paid to each",,"Verify that for applicable construction contracts, the following are included: (A) a specific description and exact location of the construction, and the date and time for the bidder to visit the job site when a mandatory pre-bid visit is required; (B) references to all applicable documents that will become part of the contract, such as specifications and terms and conditions approved by Corporation Counsel; (C) a statement of minimum insurance requirements for the bidder and any insurance coverage provided by the City; (D) a statement that the bidder must meet all licensing or permit requirements for the construction; (E) instructions for the return of bid documents if the bidder does not submit a bid, and notification to the City of the bidder's decision not to bid; (F) a statement that all bid documents must be returned to the City upon request; (G) the form in which the bid is to be submitted, as specified or referenced in the invitation for bids; (H) a requirement for all bidders to examine bid packages for all parts of the project when multiple prime contractors are involved; (I) a notice that contract award is subject to Section 6-108.1 of the New York City Administrative Code for contracts not subject to Section 6-129; and (J) a requirement for a separate sealed list of subcontractors and payment amounts for work not requiring separate specifications under New York General Municipal Law Section 101.",,,FALSE
"If award will be made on the basis of best value to the City, such statement shall include how best value will be determined in accordance with Section 3-02(o) of these Rules",,Verify that any award made on the basis of best value to the City includes a statement detailing how best value is determined in accordance with Section 3-02(o) of these Rules.,,,FALSE
The bidding time shall be not less than fifteen days before the bid opening date,,Verify that the bidding time is at least fifteen days before the bid opening date.,,,FALSE
"The IFB will provide a form on which the bidder must insert the bid price, or other information requested, if any, pursuant to Section 3-02(o)(1) of these Rules, and must sign and submit along with all other necessary submissions",,"Verify that the bidder has inserted the bid price or other requested information on the provided form, signed it, and submitted it along with all other necessary submissions.",,,FALSE
