rule,type,nlc,dc,sql,link
"Under the circumstances set forth in this subdivision, the ACCO may determine that it is appropriate to reject all bids after opening and before vendor selection and to complete the acquisition by a new solicitation for which notice is provided as set forth in this subdivision",,"Verify that under the specified circumstances, the ACCO has determined it is appropriate to reject all bids after opening and before vendor selection, and has completed the acquisition by a new solicitation with notice provided as specified.",,,FALSE
"This procedure may be used where at least five responses to the solicitation have been received, and despite efforts to address problems in the solicitation by means of prebid conferences and issuance of amended specifications in accordance with these Rules, all responses are found to be non-responsive as a result of the same defect(s) in the specification or other solicitation documents",,"Verify that this procedure is used only when at least five responses to the solicitation have been received, and all responses are found to be non-responsive due to the same defect(s) in the specification or other solicitation documents, despite efforts to address these problems through prebid conferences and issuance of amended specifications.",,,FALSE
"When using this procedure, the ACCO shall: (i) make a determination that: (A) five or more bids have been received in response to the original solicitation; (B) all of the bids have been found to be non-responsive as a result of the same previously unresolved defect(s) in the solicitation documents; and (C) prior to opening the bids the agency had made diligent efforts to discover and correct defects in the solicitation documents by inviting questions from prospective bidders, holding pre-bid conferences, and issuing amendments to the solicitation documents as appropriate;",,"Verify that when using this procedure, the ACCO has made a determination that: (A) five or more bids have been received in response to the original solicitation; (B) all of the bids have been found to be non-responsive due to the same previously unresolved defect(s) in the solicitation documents; and (C) prior to opening the bids, the agency made diligent efforts to discover and correct defects in the solicitation documents by inviting questions from prospective bidders, holding pre-bid conferences, and issuing amendments to the solicitation documents as appropriate.",,,FALSE
All bids shall be retained,,Verify that all bids are retained.,,,FALSE
"When bids are rejected or a solicitation canceled after bids are received, the bids shall be retained and the bid security, if any, shall be promptly returned, and the file so documented",,"Verify that when bids are rejected or a solicitation is canceled after bids are received, the bids are retained, the bid security, if any, is promptly returned, and the file is documented accordingly.",,,FALSE