rule,type,nlc,dc,sql,link
Clean and sanitize all food-preparation surfaces after each use; remove caked-on food.,D,"Verify that all food-preparation surfaces are cleaned and sanitized after each use, and that caked-on food has been removed.",,,FALSE
Repair or replace deeply-grooved cutting boards and chipped or broken surfaces so they can be properly sanitized.,D,Verify that deeply-grooved cutting boards and chipped or broken surfaces are repaired or replaced so they can be properly sanitized.,,,FALSE
Maintain all non-food surfaces.,D,Verify that all non-food surfaces are maintained.,,,FALSE
Review Health Department rules on acceptable materials; surfaces should be smooth and cleanable.,D,"Verify that all materials and surfaces are smooth and cleanable, as per Health Department rules.",,,FALSE
Keep all surfaces clean.,D,Verify that all surfaces are kept clean.,,,FALSE
Maintain all plumbing and check it frequently.,D,Verify that all plumbing is being maintained and checked frequently.,,,FALSE
Monitor all plumbing fixtures and make needed repairs immediately.,D,Verify that all plumbing fixtures are being monitored and that any needed repairs are being made immediately.,,,FALSE
"Be sure plumbing is fitted with approved devices (valves, anti-siphonage pieces, vacuum breakers) to prevent backflow.",D,"Verify that the plumbing is fitted with approved devices (valves, anti-siphonage pieces, vacuum breakers) to prevent backflow.",,,FALSE
Clean and maintain grease traps.,D,Verify that grease traps are cleaned and maintained.,,,FALSE